### ISSUE TITLE
Not receiving all disconnected notifications

### ISSUE THREAD

**Issue by bridger** [IBM-Swift/Kitura-WebSocket-NIO#38]
I'm having trouble cleaning up old connections in my application server. I investigated and saw that it isn't receiving the disconnected callback (defined on `WebSocketService.swift`) for each connection.

I tried refreshing a browser a lot so there are lots of short lived connections. I got 81 callbacks saying there was a new connection, but only 41 callbacks saying a connection had closed.

These connections probably weren't shut down properly client-side, so the server might not know they are dead. I had a ping handler set up to clean up dead connections, but it looks like that API is only in the non-NIO version of websockets. Can we port over that API? https://github.com/IBM-Swift/Kitura-WebSocket/pull/48

**Comment by bridger** [comment]
@pushkarnk On another issue you said
>  I tested a very simple scenario of handful browser tabs connecting to a ws server and disconnecting. I could see the disconnected(connection:reason) callback being invoked. I'll wait for more details what you observed.

I am seeing disconnected called most of the time, just not *every* time. The way I measured it was by putting a log on each connect and disconnect. I refreshed the browser a bunch of times and then I counted how many messages for connected and disconnected were in the log.

If you want to share the code for your scenario I can see if I can repro it with your setup, or if it is specific to my application.

Either way, I think the pinging feature would be super useful. It is often the case that a connection dies silently without the client sending a "goingAway" message. The only way I know to detect those ghost connections is by pinging them to test if they are alive.

**Comment by pushkarnk** [comment]
Surprisingly, things are quite straightforward with Kitura-NIO:
```
tcpdump: verbose output suppressed, use -v or -vv for full protocol decode
listening on lo, link-type EN10MB (Ethernet), capture size 262144 bytes
```

**Header for the first request arrives from remote port 39596**
```
06:37:32.514466 IP localhost.39596 > localhost.http-alt: Flags [P.], seq 3181728486:3181728759, ack 4033032946, win 342, options [nop,nop,TS val 1482612727 ecr 1482612726], length 273: HTTP: POST /users HTTP/1.1
	0x0000:  4500 0145 78d9 4000 4006 c2d7 7f00 0001  E..Ex.@.@.......
	0x0010:  7f00 0001 9aac 1f90 bda5 52e6 f063 32f2  ..........R..c2.
	0x0020:  8018 0156 ff39 0000 0101 080a 585e dff7  ...V.9......X^..
	0x0030:  585e dff6 504f 5354 202f 7573 6572 7320  X^..POST./users.
	0x0040:  4854 5450 2f31 2e31 0d0a 486f 7374 3a20  HTTP/1.1..Host:.
	0x0050:  6c6f 6361 6c68 6f73 743a 3830 3830 0d0a  localhost:8080..
	0x0060:  4163 6365 7074 2d45 6e63 6f64 696e 673a  Accept-Encoding:
	0x0070:  2064 6566 6c61 7465 2c20 677a 6970 0d0a  .deflate,.gzip..
	0x0080:  436f 6e74 656e 742d 5479 7065 3a20 6170  Content-Type:.ap
	0x0090:  706c 6963 6174 696f 6e2f 6a73 6f6e 0d0a  plication/json..
	0x00a0:  4163 6365 7074 3a20 6170 706c 6963 6174  Accept:.applicat
	0x00b0:  696f 6e2f 6a73 6f6e 0d0a 436f 6e6e 6563  ion/json..Connec
	0x00c0:  7469 6f6e 3a20 6b65 6570 2d61 6c69 7665  tion:.keep-alive
	0x00d0:  0d0a 5573 6572 2d41 6765 6e74 3a20 4b69  ..User-Agent:.Ki
	0x00e0:  7475 7261 4b69 7450 6163 6b61 6765 5465  turaKitPackageTe
	0x00f0:  7374 732e 7863 7465 7374 2028 756e 6b6e  sts.xctest.(unkn
	0x0100:  6f77 6e20 7665 7273 696f 6e29 2063 7572  own.version).cur
	0x0110:  6c2f 372e 3538 2e30 0d0a 4163 6365 7074  l/7.58.0..Accept
	0x0120:  2d4c 616e 6775 6167 653a 2065 6e0d 0a43  -Language:.en..C
	0x0130:  6f6e 7465 6e74 2d4c 656e 6774 683a 2034  ontent-Length:.4
	0x0140:  330d 0a0d 0a                             3....
```

**Body pertaining to the first request arrives from remote port 39596**
```
06:37:32.514540 IP localhost.39596 > localhost.http-alt: Flags [P.], seq 273:316, ack 1, win 342, options [nop,nop,TS val 1482612727 ecr 1482612727], length 43: HTTP
	0x0000:  4500 005f 78da 4000 4006 c3bc 7f00 0001  E.._x.@.@.......
	0x0010:  7f00 0001 9aac 1f90 bda5 53f7 f063 32f2  ..........S..c2.
	0x0020:  8018 0156 fe53 0000 0101 080a 585e dff7  ...V.S......X^..
	0x0030:  585e dff7 7b22 6964 223a 352c 226e 616d  X^..{"id":5,"nam
	0x0040:  6522 3a22 4a6f 686e 2044 6f65 222c 2264  e":"John.Doe","d
	0x0050:  6174 6522 3a35 3430 3839 3932 3536 7d    ate":540899256}
```

**Response is sent to remote port 39596**
```
06:37:32.518937 IP localhost.http-alt > localhost.39596: Flags [P.], seq 1:207, ack 316, win 350, options [nop,nop,TS val 1482612731 ecr 1482612727], length 206: HTTP: HTTP/1.1 201 Created
	0x0000:  4500 0102 18c3 4000 4006 2331 7f00 0001  E.....@.@.#1....
	0x0010:  7f00 0001 1f90 9aac f063 32f2 bda5 5422  .........c2...T"
	0x0020:  8018 015e fef6 0000 0101 080a 585e dffb  ...^........X^..
	0x0030:  585e dff7 4854 5450 2f31 2e31 2032 3031  X^..HTTP/1.1.201
	0x0040:  2043 7265 6174 6564 0d0a 4461 7465 3a20  .Created..Date:.
	0x0050:  4672 692c 2031 3220 4a75 6c20 3230 3139  Fri,.12.Jul.2019
	0x0060:  2030 353a 3337 3a33 3220 474d 540d 0a43  .05:37:32.GMT..C
	0x0070:  6f6e 7465 6e74 2d54 7970 653a 2061 7070  ontent-Type:.app
	0x0080:  6c69 6361 7469 6f6e 2f6a 736f 6e0d 0a43  lication/json..C
	0x0090:  6f6e 7465 6e74 2d4c 656e 6774 683a 2034  ontent-Length:.4
	0x00a0:  330d 0a43 6f6e 6e65 6374 696f 6e3a 204b  3..Connection:.K
	0x00b0:  6565 702d 416c 6976 650d 0a4b 6565 702d  eep-Alive..Keep-
	0x00c0:  416c 6976 653a 2074 696d 656f 7574 3d36  Alive:.timeout=6
	0x00d0:  302e 300d 0a0d 0a7b 226e 616d 6522 3a22  0.0....{"name":"
	0x00e0:  4a6f 686e 2044 6f65 222c 2269 6422 3a35  John.Doe","id":5
	0x00f0:  2c22 6461 7465 223a 3534 3038 3939 3235  ,"date":54089925
	0x0100:  367d                                     6}
```

**Header of the second request arrives from the same port 39596**
```
06:37:32.559200 IP localhost.39596 > localhost.http-alt: Flags [P.], seq 316:591, ack 207, win 350, options [nop,nop,TS val 1482612771 ecr 1482612731], length 275: HTTP: POST /usersid HTTP/1.1
	0x0000:  4500 0147 78dc 4000 4006 c2d2 7f00 0001  E..Gx.@.@.......
	0x0010:  7f00 0001 9aac 1f90 bda5 5422 f063 33c0  ..........T".c3.
	0x0020:  8018 015e ff3b 0000 0101 080a 585e e023  ...^.;......X^.#
	0x0030:  585e dffb 504f 5354 202f 7573 6572 7369  X^..POST./usersi
	0x0040:  6420 4854 5450 2f31 2e31 0d0a 486f 7374  d.HTTP/1.1..Host
	0x0050:  3a20 6c6f 6361 6c68 6f73 743a 3830 3830  :.localhost:8080
	0x0060:  0d0a 4163 6365 7074 2d45 6e63 6f64 696e  ..Accept-Encodin
	0x0070:  673a 2064 6566 6c61 7465 2c20 677a 6970  g:.deflate,.gzip
	0x0080:  0d0a 4163 6365 7074 3a20 6170 706c 6963  ..Accept:.applic
	0x0090:  6174 696f 6e2f 6a73 6f6e 0d0a 436f 6e74  ation/json..Cont
	0x00a0:  656e 742d 5479 7065 3a20 6170 706c 6963  ent-Type:.applic
	0x00b0:  6174 696f 6e2f 6a73 6f6e 0d0a 436f 6e6e  ation/json..Conn
	0x00c0:  6563 7469 6f6e 3a20 6b65 6570 2d61 6c69  ection:.keep-ali
	0x00d0:  7665 0d0a 5573 6572 2d41 6765 6e74 3a20  ve..User-Agent:.
	0x00e0:  4b69 7475 7261 4b69 7450 6163 6b61 6765  KituraKitPackage
	0x00f0:  5465 7374 732e 7863 7465 7374 2028 756e  Tests.xctest.(un
	0x0100:  6b6e 6f77 6e20 7665 7273 696f 6e29 2063  known.version).c
	0x0110:  7572 6c2f 372e 3538 2e30 0d0a 4163 6365  url/7.58.0..Acce
	0x0120:  7074 2d4c 616e 6775 6167 653a 2065 6e0d  pt-Language:.en.
	0x0130:  0a43 6f6e 7465 6e74 2d4c 656e 6774 683a  .Content-Length:
	0x0140:  2034 390d 0a0d 0a                        .49....
```

**Body of the second request arrives from the same port 39596**
```
06:37:32.559247 IP localhost.39596 > localhost.http-alt: Flags [P.], seq 591:640, ack 207, win 350, options [nop,nop,TS val 1482612771 ecr 1482612731], length 49: HTTP
	0x0000:  4500 0065 78dd 4000 4006 c3b3 7f00 0001  E..ex.@.@.......
	0x0010:  7f00 0001 9aac 1f90 bda5 5535 f063 33c0  ..........U5.c3.
	0x0020:  8018 015e fe59 0000 0101 080a 585e e023  ...^.Y......X^.#
	0x0030:  585e dffb 7b22 6964 223a 352c 226e 616d  X^..{"id":5,"nam
	0x0040:  6522 3a22 4a6f 6e61 7468 616e 2053 7769  e":"Jonathan.Swi
	0x0050:  6674 222c 2264 6174 6522 3a35 3430 3839  ft","date":54089
	0x0060:  3932 3536 7d                             9256}
```

**Response for the second response sent to remote port 39596**
```
06:37:32.560227 IP localhost.http-alt > localhost.39596: Flags [P.], seq 207:432, ack 640, win 359, options [nop,nop,TS val 1482612772 ecr 1482612771], length 225: HTTP: HTTP/1.1 201 Created
	0x0000:  4500 0115 18c5 4000 4006 231c 7f00 0001  E.....@.@.#.....
	0x0010:  7f00 0001 1f90 9aac f063 33c0 bda5 5566  .........c3...Uf
	0x0020:  8018 0167 ff09 0000 0101 080a 585e e024  ...g........X^.$
	0x0030:  585e e023 4854 5450 2f31 2e31 2032 3031  X^.#HTTP/1.1.201
	0x0040:  2043 7265 6174 6564 0d0a 4461 7465 3a20  .Created..Date:.
	0x0050:  4672 692c 2031 3220 4a75 6c20 3230 3139  Fri,.12.Jul.2019
	0x0060:  2030 353a 3337 3a33 3220 474d 540d 0a4c  .05:37:32.GMT..L
	0x0070:  6f63 6174 696f 6e3a 2035 0d0a 436f 6e74  ocation:.5..Cont
	0x0080:  656e 742d 5479 7065 3a20 6170 706c 6963  ent-Type:.applic
	0x0090:  6174 696f 6e2f 6a73 6f6e 0d0a 436f 6e74  ation/json..Cont
	0x00a0:  656e 742d 4c65 6e67 7468 3a20 3439 0d0a  ent-Length:.49..
	0x00b0:  436f 6e6e 6563 7469 6f6e 3a20 4b65 6570  Connection:.Keep
	0x00c0:  2d41 6c69 7665 0d0a 4b65 6570 2d41 6c69  -Alive..Keep-Ali
	0x00d0:  7665 3a20 7469 6d65 6f75 743d 3630 2e30  ve:.timeout=60.0
	0x00e0:  0d0a 0d0a 7b22 6e61 6d65 223a 224a 6f6e  ....{"name":"Jon
	0x00f0:  6174 6861 6e20 5377 6966 7422 2c22 6964  athan.Swift","id
	0x0100:  223a 352c 2264 6174 6522 3a35 3430 3839  ":5,"date":54089
	0x0110:  3932 3536 7d                             9256}
```

**Comment by pushkarnk** [comment]
@bridger I wasn't able to repro what you said with 10-12 tabs. So, I wrote a [JS client](https://gist.github.com/pushkarnk/b63275f98acfe86d6251074c54e6dc9c) that makes N connections to the [test WebSocket server](https://github.com/IBM-Swift/Kitura-WebSocket-NIO/tree/master/Sources/TestWebSocketService), sends two messages and closes one connection per second. 

If I make more than 20 connections, I see that the `disconnected()` callback hasn't been invoked on a handful of them. The number of misses is, of course, random. 

You are right. This needs investigation.

**Comment by pushkarnk** [comment]
I also found a new Kitura-NIO bug testing with the JS client: https://github.com/IBM-Swift/Kitura-NIO/pull/215

**Comment by pushkarnk** [comment]
Ported IBM-Swift/Kitura-WebSocket#48 through #40

**Comment by pushkarnk** [comment]
I think I have found the reason for the WebSocket connection not receiving all the `disconnected` notifications. It is a bug in `Kitura-NIO`. Here's the possible fix: https://github.com/IBM-Swift/Kitura-NIO/pull/217

I ran a WebSocket client with 500 concurrent connections and closing them one connection per second. We seem to be getting the `disconnected` callback invoked on all of the connections.

**Comment by bridger** [comment]
Today I tried updating everything (Kitura-WebSocket-NIO was on commit https://github.com/IBM-Swift/Kitura-WebSocket-NIO/commit/b98bb3e72c6ff7fb4fd084985cdf427dfa2fd7f0 and Kitura-NIO was at version 2.2.0). I am unfortunately still seeing some connections never get disconnected. I'm afraid this would cause memory leaks that would crash the server pretty often. If there are any other tests I can run, let me know.

**Comment by weissi** [comment]
@bridger to help the Kitura folks debug, could you check if NIO sends a `channelInactive` event?

**Comment by bridger** [comment]
@weissi helped look into this. It looks like Kitura doesn’t implement the channelInactive or errorCaught callbacks. Without these, we’d only get notified if the channel closes cleanly. If the tcp channel is interrupted then Kitura won’t know about it. The solution is likely implementing both of those callbacks and then notifying about the close.

<sub>Sent with <a href="http://githawk.com">GitHawk</a></sub>

**Comment by pushkarnk** [comment]
Thanks @weissi and @bridger for the investigation - Yes, we should implement those callbacks. I'll take that up (Sorry for the late response, I was away yesterday).
